{
  "schema": "movscript.agent.settings.snapshot.v1",
  "schemaVersion": 1,
  "schemaUrl": "https://movscript.dev/schemas/agent-settings-snapshot-v1.schema.json",
  "exportedAt": "2026-05-18T00:00:00.000Z",
  "model": {
    "model": "gpt-5.4",
    "apiKind": "openai_responses",
    "useForChat": true,
    "useForPlanner": true
  },
  "activeConfigFileId": "base",
  "configFiles": [
    {
      "schema": "movscript.agent.config_file.v1",
      "id": "base",
      "version": "1.0.0",
      "name": "Base",
      "description": "Base runtime configuration.",
      "enabledPackIds": ["core", "movscript"],
      "skillIds": ["agent-core.memory-access"],
      "approvalDefaults": {
        "write": "on_write",
        "destructive": "always"
      },
      "toolGrants": [
        {
          "name": "movscript_update_active_skills",
          "mode": "allow",
          "approval": "never"
        }
      ],
      "model": {
        "provider": "openai",
        "modelId": "gpt-5.4",
        "routes": [
          {
            "when": {
              "task": ["reasoning", "text", "multimodal", "planning"]
            },
            "use": {
              "provider": "openai",
              "modelId": "gpt-5.4"
            }
          }
        ]
      },
      "limits": {
        "contextWindowCharLimit": 120000,
        "maxHistoryMessages": 24
      },
      "metadata": {
        "managed": true
      }
    },
    {
      "schema": "movscript.agent.config_file.v1",
      "id": "review",
      "version": "1.0.0",
      "name": "Review",
      "description": "Review-focused runtime configuration.",
      "enabledPackIds": ["core"],
      "skillIds": ["agent-core.memory-access"],
      "approvalDefaults": {
        "default": "on_write",
        "write": "always"
      },
      "toolGrants": [
        {
          "name": "core_file_read",
          "mode": "allow",
          "approval": "never"
        }
      ],
      "limits": {
        "contextWindowCharLimit": 80000,
        "maxHistoryMessages": 12
      },
      "metadata": {
        "managed": false
      }
    }
  ],
  "providerSessionLimits": {
    "maxToolCalls": 20,
    "maxIterations": 8,
    "executionMode": "standard",
    "allowForcedToolCalls": false,
    "contextWindowCharLimit": 120000,
    "maxHistoryMessages": 24
  },
  "skillConfig": [
    {
      "id": "agent-core.memory-access",
      "enabled": true
    }
  ],
  "toolPermissionOverrides": [
    {
      "configFileId": "base",
      "toolGrants": [
        {
          "name": "movscript_update_active_skills",
          "mode": "allow",
          "approval": "never"
        }
      ]
    },
    {
      "configFileId": "review",
      "toolGrants": [
        {
          "name": "core_file_read",
          "mode": "allow",
          "approval": "never"
        }
      ]
    }
  ]
}
